tweet_id;screenname;city;date;text;source;reply_to;is_quote;retweetet_count;favorited_count;hashtags;retweeted_text;retweeted_user;is_retweet
936625261243756546;GOstbevern;Ostbevern;2017-12-01 15:57:18;b'Schwimmen bei Kerzenschein heute Abend von 19 - 20.30 Uhr im #BEVERBAD #Ostbevern. Auch am Freitag, 08., 15. + 22.12.2017. https://t.co/Up8mjHAvQT';Twitter Web Client;;False;0;0;BEVERBAD,Ostbevern;;;False
935881757169278977;GOstbevern;Ostbevern;2017-11-29 14:42:53;b'Winterzauber in #Ostbevern. Morgen geht es los. Immer donnerstags von 16-21 Uhr auf dem Kirchplatz #stambrosius. https://t.co/pbp8z9kI12';Twitter Web Client;;False;1;2;Ostbevern,stambrosius;;;False
934031560071892993;GOstbevern;Ostbevern;2017-11-24 12:10:52;b'NEIN zu Gewalt an Frauen! Auf diesen Internationalen Aktionstag, der jedes Jahr am 25. Nov. stattfindet, weisen an diesem WE die Fahnen vor dem Rathaus #Ostbevern hin. https://t.co/Gy8Qxr3wPB';Twitter Web Client;;False;0;0;Ostbevern;;;False
933281519224926209;GOstbevern;Ostbevern;2017-11-22 10:30:28;b'Es wird weihnachtlich in #Ostbevern. Die Mitarbeiter des gemeindlichen Bauhofes bringen derzeit die Weihnachtsbeleuchtung im Ort an. https://t.co/WV2YB69BnC';Twitter Web Client;;False;0;0;Ostbevern;;;False
932942167638765568;GOstbevern;Ostbevern;2017-11-21 12:02:00;b'Der #Ostbevern Touristik e.V. feiert zur Stunde den Umzug in die neue Gesch\xc3\xa4ftsstelle an der Hauptstr. 43. https://t.co/058UylhVVb';Twitter Web Client;;False;0;1;Ostbevern;;;False
