tweet_id;screenname;city;date;text;source;reply_to;is_quote;retweetet_count;favorited_count;hashtags;retweeted_text;retweeted_user;is_retweet
931559118476890112;RathausGrefrath;Grefrath;2017-11-17 16:26:16;b'Azubi Angebot der Gemeindewerke https://t.co/K4u8qOVjMH';Facebook;;False;0;0;;;;False
931449615236456448;RathausGrefrath;Grefrath;2017-11-17 09:11:08;b'Es gibt Freikarten zu gewinnen ! https://t.co/F0Ul7MVwxo';Facebook;;False;0;0;;;;False
931429354856439808;RathausGrefrath;Grefrath;2017-11-17 07:50:37;b'Es tut sich was im ehemaligen Fibrit-Gel\xc3\xa4nde.... https://t.co/LP3ZM1HtRD';Facebook;;False;0;0;;;;False
931428730458779648;RathausGrefrath;Grefrath;2017-11-17 07:48:09;b'Unterst\xc3\xbctzt die Jungs im Eisstadion ! https://t.co/Rob69zY1Wr';Facebook;;False;0;0;;;;False
931405913369477121;RathausGrefrath;Grefrath;2017-11-17 06:17:29;b'Der Countdown l\xc3\xa4uft, nur noch 14 Tage bis zur Weltpremiere von HOLIDAY ON ICE in Grefrath\n \nDas Original aller... https://t.co/MGO3sMAjPb';Facebook;;False;0;0;;;;False
