tweet_id,screenname,city,date,text,source,reply_to,is_quote,retweetet_count,favorited_count,hashtags,retweeted_text,retweeted_user,is_retweet
930095409959186432,siegburgaktuell,Siegburg,2017-11-13 15:30:00,"b'Sehr schick saniert, dieses Siegburger Hotel. Dass Sie darin \xc3\xbcbernachten werden, ist unwahrscheinlich. Es sei... https://t.co/gaZ8haclYv'",Facebook,,False,0,0,,,,False
928537927847759873,siegburgaktuell,Siegburg,2017-11-09 08:21:08,b'https://t.co/YX03FzhbGD',Facebook,,False,0,1,,,,False
922824520712511489,siegburgaktuell,Siegburg,2017-10-24 13:58:05,b'Das Wolsdorfer Kinderheim wandert entlang der ehemaligen deutsch-deutschen Grenze.  Die Jugendlichen lernen eine... https://t.co/ckO8qnhujt',Facebook,,False,0,0,,,,False
922437076095782912,siegburgaktuell,Siegburg,2017-10-23 12:18:31,b'https://t.co/b7K3j0gzcx',Facebook,,False,0,0,,,,False
921702519348350977,siegburgaktuell,Siegburg,2017-10-21 11:39:39,"b'Die f\xc3\xbcr morgen vorgesehene Stadtf\xc3\xbchrung (L\xc3\xbcgentour), bei der Flunkereien erraten werden m\xc3\xbcssen, entf\xc3\xa4llt. Es gab nicht gen\xc3\xbcgend Anmeldungen.'",Facebook,,False,0,0,,,,False
921295951721058305,siegburgaktuell,Siegburg,2017-10-20 08:44:06,b'Gerne weisen wir auf ein tolles Programm rund um die Er\xc3\xb6ffnung des Erzquellweges Sieg am Sonntag hin.\n\nSch\xc3\xb6nes... https://t.co/3ivLvE7016',Facebook,,False,0,0,,,,False
919957463927066625,siegburgaktuell,Siegburg,2017-10-16 16:05:26,"b'Hubschrauberf\xc3\xa4llung am Michaelsberg war f\xc3\xbcr morgen geplant, wird jetzt aber verschoben: Das ausf\xc3\xbchrende... https://t.co/vQL2qNyQsz'",Facebook,,False,0,0,,,,False
917752698270900224,siegburgaktuell,Siegburg,2017-10-10 14:04:28,"b'Attention please, Stra\xc3\x9fen NRW hat in K\xc3\xb6ln die Bombe, die eine Metallstange war, gefunden, und konzentriert sich... https://t.co/jaUMivpcJr'",Facebook,,False,0,0,,,,False
916273141927858176,siegburgaktuell,Siegburg,2017-10-06 12:05:15,b'https://t.co/knN08bf0lo',Facebook,,False,0,0,,,,False
912655304986431488,siegburgaktuell,Siegburg,2017-09-26 12:29:15,"b'Am Sonntag in einem Siegburger Wahllokal. Es ist 15 Uhr, eine \xc3\xa4ltere Dame tritt ein. Ihre Laune ist schlecht. Da... https://t.co/WOOMeu02mH'",Facebook,,False,0,0,,,,False
911918835900534784,siegburgaktuell,Siegburg,2017-09-24 11:42:47,b'45 Prozent haben bis 12 Uhr gew\xc3\xa4hlt. Bis 18 Uhr kann noch vom B\xc3\xbcrgerrecht Gebrauch gemacht werden.',Facebook,,False,0,0,,,,False
909808026470813696,siegburgaktuell,Siegburg,2017-09-18 15:55:11,b'Zur in diesem Sozialen Netzwerk gef\xc3\xbchrten Diskussion um die st\xc3\xa4dtischen Steuereinnahmen sei Folgendes gesagt:... https://t.co/HRF4dETRvg',Facebook,,False,0,1,,,,False
909396326441537537,siegburgaktuell,Siegburg,2017-09-17 12:39:14,"b'September-Triathlon heute in Siegburg: Laufen, Schie\xc3\x9fen, Einkaufen!'",Facebook,,False,0,0,,,,False
901125166314520579,siegburgaktuell,Siegburg,2017-08-25 16:52:36,b'Stadtfest von A wie Anschlagen bis Z wie Zapfen. Kurzum: Es geht los!!!',Facebook,,False,0,1,,,,False
898192252513726465,siegburgaktuell,Siegburg,2017-08-17 14:38:15,b'Zur Info:\nAnschlussstelle Br\xc3\xbcckberg  in Richtung Much gesperrt\nLandesbetrieb saniert B56\n\nIm Zuge der Sanierung... https://t.co/2AkFHJzDOi',Facebook,,False,0,0,,,,False
894589011905449984,siegburgaktuell,Siegburg,2017-08-07 16:00:15,"b'Skaten, E-Skaten, Hochseilgarten. Eine Menge los in der ""Actionwoche"" des Jugendzentrums Deichhaus. Langeweile?... https://t.co/DAJyBkzoVw'",Facebook,,False,0,0,,,,False
892030053999161344,siegburgaktuell,Siegburg,2017-07-31 14:31:52,b'Drei Schwer- und f\xc3\xbcnf Leichtverletzte bei zwei Unf\xc3\xa4llen auf der L332 (Wilhelmstra\xc3\x9fe). \xc3\x9cber den Link zu den... https://t.co/7crMhnueGA',Facebook,,False,0,0,,,,False
890608282204688384,siegburgaktuell,Siegburg,2017-07-27 16:22:15,"b'Was schwimmt da im Trerichsweiher?\n\nEin Hecht, ein Wels? Im Trerichsweiher verbirgt sich ein Tier, das Jagd auf... https://t.co/iGMpQXrAh6'",Facebook,,False,0,1,,,,False
890513389545455617,siegburgaktuell,Siegburg,2017-07-27 10:05:11,b'Neues Beleuchtungskonzept senkt Stromkosten auf ein Viertel\n\nAbteiturm erstrahlt wieder\n\nDie alten Strahler der... https://t.co/HLMgen5wJR',Facebook,,False,0,0,,,,False
890117319535538177,siegburgaktuell,Siegburg,2017-07-26 07:51:21,"b""Siegburg live - heute:\n\xe2\x80\x9eEx'n Rock\xe2\x80\x9c spielen von 18 bis 21 Uhr auf dem Markt!\n\nF\xc3\xbcnf Musiker aus Bonn und Umgebung,... https://t.co/OL41tGkSjn""",Facebook,,False,0,0,,,,False
889787109954990084,siegburgaktuell,Siegburg,2017-07-25 09:59:13,"b'Julchen kennt alle, alle kennen Julchen,\nSie auch?\n\nJulchen feiert diesen Monat ihren 20. (!) Geburtstag. Sie... https://t.co/nFxknj4ZmZ'",Facebook,,False,0,1,,,,False
889398688300380161,siegburgaktuell,Siegburg,2017-07-24 08:15:46,b'Gerne vormerken: \nSommerfest der L\xc3\xb6schgruppe Wolsdorf steigt am 5. August\n\nDie weit \xc3\xbcber Siegburg bekannte... https://t.co/LYXGVMUXnN',Facebook,,False,0,0,,,,False
887643224441065472,siegburgaktuell,Siegburg,2017-07-19 12:00:10,"b'In 4 Stunden geht es los - Siegburg live!\n\n""JimButton\'s"" verspricht ""G\xc3\xa4nsehaut und Gl\xc3\xbccksgef\xc3\xbchle"" https://t.co/vSs88zY4EX'",Facebook,,False,0,0,,,,False
887229251224776704,siegburgaktuell,Siegburg,2017-07-18 08:35:12,"b'Achtung \xe2\x80\x93 Landesbetrieb sperrt und saniert!\n\nVon kommenden Freitag, 22 Uhr, bis Dienstag, 5 Uhr, kappt der f\xc3\xbcr... https://t.co/3BJAIqueiX'",Facebook,,False,0,0,,,,False
886866858460282882,siegburgaktuell,Siegburg,2017-07-17 08:35:10,b'R\xc3\xbcckblick: Die Sommerferien wurden an der Grundschule Nord auch in diesem Jahr durch ein leckeres Eis... https://t.co/HHQd4eg8CS',Facebook,,False,0,0,,,,False
885831589543936000,siegburgaktuell,Siegburg,2017-07-14 12:01:23,b'Allen da drau\xc3\x9fen sch\xc3\xb6ne Sommerferien! Wir bet\xc3\xa4tigen uns heute als inoffizielles Reiseb\xc3\xbcro und empfehlen die... https://t.co/Czct8mTEHS',Facebook,,False,0,1,,,,False
885154976003219456,siegburgaktuell,Siegburg,2017-07-12 15:12:46,b'Trotz Schei... wetter: Siegburg live mit den Lustigen Musikanten gleich ab sechs. Lustig dem Regen die Stirn... https://t.co/bzTQiw4r1l',Facebook,,False,0,0,,,,False
884740177184391169,siegburgaktuell,Siegburg,2017-07-11 11:44:30,"b'Was macht Siegburg in Sachen Klimaschutz? Was kann, was muss besser werden? Einladung zum Klimaforum heute Abend,... https://t.co/jfBgyzLFgR'",Facebook,,False,0,0,,,,False
883979037969960960,siegburgaktuell,Siegburg,2017-07-09 09:20:00,b'Der Siegburger Keramikmarkt ist seit einer halben Stunde in vollem Gange. Bis 18 Uhr bieten knapp 70 ausgew\xc3\xa4hlte... https://t.co/w91BvF29MS',Facebook,,False,0,0,,,,False
883744066277605377,siegburgaktuell,Siegburg,2017-07-08 17:46:19,"b""Auf dem Markt beim Einzeichnen der St\xc3\xa4nde f\xc3\xbcr den Keramikmarkt. Morgen um 10.30 Uhr geht's los! https://t.co/t8HjpX9mzP""",Facebook,,False,0,1,,,,False
883298321531580416,siegburgaktuell,Siegburg,2017-07-07 12:15:05,"b'Die Funken feten heute und morgen auf dem M\xc3\xbchlentorplatz, die Griechische Gemeinde macht es sich Sa. und So. an... https://t.co/YfTZKyEIT3'",Facebook,,False,0,0,,,,False
882570741539115008,siegburgaktuell,Siegburg,2017-07-05 12:03:56,"b'""Nein, wir machen nicht drau\xc3\x9fen Unterricht, nur weil ihr keine Lust auf Unterricht habt!"" So unsensibel... https://t.co/wPkwHo0oQP'",Facebook,,False,1,0,,,,False
882117882263609344,siegburgaktuell,Siegburg,2017-07-04 06:04:26,b'Technische St\xc3\xb6rung im Rathaus. \nUnter anderem ist der B\xc3\xbcrgerservice derzeit leider nicht arbeitsf\xc3\xa4hig.\nWir melden... https://t.co/T1czsfBWq1',Facebook,,False,0,0,,,,False
880749404277407744,siegburgaktuell,Siegburg,2017-06-30 11:26:36,"b'Kein Eiertanz, eine richtig Gute Form. Die Tischler stellen demn\xc3\xa4chst wieder im Museum aus. Gesellenst\xc3\xbccke zum... https://t.co/0c8MEUenyJ'",Facebook,,False,0,0,,,,False
880418218791366656,siegburgaktuell,Siegburg,2017-06-29 13:30:35,b'Mit Instagram Geld verdienen? Die ehemaligen Anno-Sch\xc3\xbcler Thomas Banik und David Renken machen das. Sie wissen... https://t.co/8Ap75VDhbK',Facebook,,False,0,0,,,,False
877856044898189312,siegburgaktuell,Siegburg,2017-06-22 11:49:25,"b'Weil Siegburg in Sachen Unwetter leidgepr\xc3\xbcft ist, warnen wir lieber einmal mehr: Gro\xc3\x9fe Hitze bis 36 Grad, bis in... https://t.co/hncoieOLTB'",Facebook,,False,0,0,,,,False
876793897346891776,siegburgaktuell,Siegburg,2017-06-19 13:28:49,"b'Fette Beats, krasser Style - die ""Kulti-Allstarz"" drehten ein Musikvideo am Rhein. Rap und Hip Hop geh\xc3\xb6ren zu dem... https://t.co/VASinhJMB0'",Facebook,,False,0,0,,,,False
874660518195232769,siegburgaktuell,Siegburg,2017-06-13 16:11:32,"b'Wie der Klimawandel den Trerichsweiher ver\xc3\xa4ndern wird. Exkursion am Sonntag, 18.6. Treffpunkt... https://t.co/fPMYGpVGki'",Facebook,,False,0,0,,,,False
873594591693479936,siegburgaktuell,Siegburg,2017-06-10 17:35:55,b'Die Kollegen der Tourist Information sind anl\xc3\xa4sslich des Keramikmarkts in H\xc3\xb6hr-Grenzhausen heute und morgen zu... https://t.co/5lPA0XAVLU',Facebook,,False,0,0,,,,False
873146726567247872,siegburgaktuell,Siegburg,2017-06-09 11:56:16,"b'Viel Spa\xc3\x9f beim Fassanstechen, Bobbycarfahren, Fahnenschwenken und bei allem anderen, was \xc3\xbcblicherweise zur... https://t.co/M76Xnpo1EH'",Facebook,,False,0,2,,,,False
872746253494476800,siegburgaktuell,Siegburg,2017-06-08 09:24:56,"b'Neun Monate hat der Umbau gedauert, jetzt ist der neue OP-Bereich im Helios in Betrieb gegangen. Er ist komplett... https://t.co/20OdpyOdK7'",Facebook,,False,0,0,,,,False
872513519656341504,siegburgaktuell,Siegburg,2017-06-07 18:00:08,"b'Der Startschuss der ""Nacht der Gastronomen Siegburg"" f\xc3\xa4llt genau in einer Woche!'",Facebook,,False,0,0,,,,False
872057607653130242,siegburgaktuell,Siegburg,2017-06-06 11:48:30,"b'Fu\xc3\x9fballspa\xc3\x9f, Indianerkinder, Superhelden gesucht, Sei stark, sag Nein!, Natur- und Erlebniswoche, Sommer, Sonne,... https://t.co/xGR4Xcj14W'",Facebook,,False,0,0,,,,False
870622281688547328,siegburgaktuell,Siegburg,2017-06-02 12:45:01,"b'Sonntag ist Triathlon! Den Mitmachern viel Erfolg, den Autofahrern folgende Hinweise:... https://t.co/TSwjQ4Vyqb'",Facebook,,False,0,0,,,,False
869518941315616768,siegburgaktuell,Siegburg,2017-05-30 11:40:45,b'Wegen Unwetterwarnung kommt das Spielmobil heute NICHT auf den Spielplatz Kaldauer Feld. https://t.co/BxRjs79Sd3',Facebook,,False,0,0,,,,False
867038591389761541,siegburgaktuell,Siegburg,2017-05-23 15:24:43,b'Zum Freibad: Umkleidecontainer (Provosorium f\xc3\xbcr diese Saison) werden derzeit aufgebaut. Die Arbeiten am... https://t.co/TnpOcVpI8w',Facebook,,False,0,0,,,,False
866306800022409216,siegburgaktuell,Siegburg,2017-05-21 14:56:50,b'https://t.co/wLVrlIvJu3',Facebook,,False,0,0,,,,False
865494586654810113,siegburgaktuell,Siegburg,2017-05-19 09:09:24,"b'Nicht erschrecken um 12.15 Uhr an der Grundschule Nord. \nDort pr\xc3\xbcft der T\xc3\x9cV die Alarmierungsanlage, die im... https://t.co/7EZHHAnJI6'",Facebook,,False,0,0,,,,False
865186357697753089,siegburgaktuell,Siegburg,2017-05-18 12:44:36,b'So sehen Sieger aus - wenn sie gerade aus dem Bus gestiegen sind. Wir gratulieren der B-Jugend des TSV Wolsdorf... https://t.co/6nGpUmZOQJ',Facebook,,False,0,1,,,,False
864097855610507264,siegburgaktuell,Siegburg,2017-05-15 12:39:17,"b'Erster Tag auf dem Markt, schon kommt der Fotograf vorbei. F\xc3\xbcr den Engels Hof verkauft Anna-Lena Landeck saftige... https://t.co/jFbYNWcWYc'",Facebook,,False,0,0,,,,False
863632499829821440,siegburgaktuell,Siegburg,2017-05-14 05:50:08,b'Unsere Kolleginnen Nesrin G\xc3\xb6ksu und Dilan Cakmak aus der Tourist Information waren gestern beim Keramikmarkt in... https://t.co/G1oBVFv84F',Facebook,,False,0,0,,,,False
862929966534725632,siegburgaktuell,Siegburg,2017-05-12 07:18:31,"b""Morgen ab 11 Uhr Tag der offenen T\xc3\xbcr bei der Feuerwehr am Neuenhof. Mit viel Action. Und 'nem Grillstand. Um 20... https://t.co/vt6UM6jD5L""",Facebook,,False,0,1,,,,False
861584524169420800,siegburgaktuell,Siegburg,2017-05-08 14:12:12,"b'K\xc3\xb6nnen wir Ihnen leider nicht ersparen, was die Beh\xc3\xb6rde ""Stra\xc3\x9fen NRW"" gerade mitgeteilt hat. So viel... https://t.co/QpPmSweMN7'",Facebook,,False,0,0,,,,False
861178009876930560,siegburgaktuell,Siegburg,2017-05-07 11:16:52,b'Die Ersten str\xc3\xb6men schon. Offizieller Beginn des Tags der offenen T\xc3\xbcr beim KSI auf dem Michaelsberg gleich um... https://t.co/yy8EpO6DH4',Facebook,,False,0,0,,,,False
860134207464513539,siegburgaktuell,Siegburg,2017-05-04 14:09:10,b'Angela Merkel hat gerade mit Kardinal Woelki das Katholisch-Soziale Institut er\xc3\xb6ffnet. https://t.co/Rdo8gYCtLw',Facebook,,False,1,0,,,,False
859741253487005696,siegburgaktuell,Siegburg,2017-05-03 12:07:42,"b'W\xc3\xbcnschen sich viele Eltern j\xc3\xbcngerer P\xc3\xa4nz: Nie ein NEIN h\xc3\xb6ren.  F\xc3\xbcr die Berufsgruppe, die heute in der... https://t.co/EUpW9JuUGS'",Facebook,,False,0,0,,,,False
857542122563678209,siegburgaktuell,Siegburg,2017-04-27 10:29:09,b'Sonnenschein und 19 Grad sind f\xc3\xbcr Sonntag vorhergesagt. Von 11 bis 18 Uhr ist Antikmarkt auf dem Marktplatz. https://t.co/rJJRbhqckz',Facebook,,False,0,1,,,,False
856832118764253184,siegburgaktuell,Siegburg,2017-04-25 11:27:50,"b'Sehr viel ist fotografiert worden oben auf unserem Michaelsberg. Dieses Bild, das das Katholisch-Soziale Institut... https://t.co/wbbKnuLlFF'",Facebook,,False,1,0,,,,False
856526997622841346,siegburgaktuell,Siegburg,2017-04-24 15:15:24,b'Die 150. KFC Filiale ist er\xc3\xb6ffnet! https://t.co/cRrvCv55nJ',Facebook,,False,0,0,,,,False
855465409428017153,siegburgaktuell,Siegburg,2017-04-21 16:57:02,b'W\xc3\xb6lfe auf dem Markt? Klar. Hexen auch. Und Hexenbezwinger! Morgen in diesen Zelten tollen M\xc3\xa4rchen lauschen. Von... https://t.co/sjt3zAXyzF',Facebook,,False,0,0,,,,False
853220332513222656,siegburgaktuell,Siegburg,2017-04-15 12:15:53,"b'60 Jahre Auferstehungskirche. Osternachtfeier heute um 23 Uhr. Mit Sanduhr, aus der 1,5 Tonnen rieseln. Alle... https://t.co/ncUdq2ZYKq'",Facebook,,False,0,0,,,,False
852108159477010432,siegburgaktuell,Siegburg,2017-04-12 10:36:31,"b'Mitte Mai kommt Mittermeier in die Rhein-Sieg-Halle. Sein Programm hei\xc3\x9ft so, wie er ist - ""Wild"". Karten an der... https://t.co/E62ze8f8cw'",Facebook,,False,0,0,,,,False
851381814753144833,siegburgaktuell,Siegburg,2017-04-10 10:30:17,"b'Ab heute geht Spielmobil Armin wieder auf Tour! Montags auf dem Spielplatz Haydnstra\xc3\x9fe auf dem Deichhaus,... https://t.co/DsdBnN7jVo'",Facebook,,False,0,0,,,,False
849634893462155266,siegburgaktuell,Siegburg,2017-04-05 14:48:38,"b'Was machen die M\xc3\xa4nner am Osthang des Michaelsbergs, direkt unter den Abteimauern? L\xc3\xb6cher bohren, viele L\xc3\xb6cher.... https://t.co/GE8zPxyMXm'",Facebook,,False,0,0,,,,False
848879607701008384,siegburgaktuell,Siegburg,2017-04-03 12:47:24,"b'Das Kolpinghaus an der M\xc3\xbchlenstra\xc3\x9fe wird abgerissen, an die Stelle treten neun Wohnungen unterschiedlicher Gr\xc3\xb6\xc3\x9fe... https://t.co/5HOxv6fCXn'",Facebook,,False,0,0,,,,False
847694176367988736,siegburgaktuell,Siegburg,2017-03-31 06:16:55,"b'Guten Morgen!\n\nWir w\xc3\xbcnschen ein ""Sommer, Sonne, Sonnenschein"" Wochenende. https://t.co/cDaqVG1Aeu'",Facebook,,False,0,2,,,,False
846709774251163648,siegburgaktuell,Siegburg,2017-03-28 13:05:15,"b'Wo ist Europa? Genau da, wo junge Europ\xc3\xa4er zusammen lachen, lernen, sich ineinander verlieben. \n\nLetzte Woche war... https://t.co/VsLbmhzSXK'",Facebook,,False,0,1,,,,False
845268713175699457,siegburgaktuell,Siegburg,2017-03-24 13:39:00,"b'Jetzt steht sie wirklich vor der T\xc3\xbcr, die Fahrbahnsanierung von Stra\xc3\x9fen NRW auf der B56. Ab Montag, 27. M\xc3\xa4rz, ist... https://t.co/EV4senHyLC'",Facebook,,False,0,0,,,,False
844544140046143488,siegburgaktuell,Siegburg,2017-03-22 13:39:48,b'Kunst zu verleihen! Morgen \xc3\xb6ffnet die Artothek. https://t.co/RlbvYw5EWR',Facebook,,False,0,1,,,,False
842726202536316929,siegburgaktuell,Siegburg,2017-03-17 13:15:58,b'Wer macht mit beim Fu\xc3\x9fballturnier des Integrationsrats? Erster Ansto\xc3\x9f am 1. April um 12 Uhr in der... https://t.co/VZeLUPeewi',Facebook,,False,0,0,,,,False
842360442269892609,siegburgaktuell,Siegburg,2017-03-16 13:02:34,"b'Unsere W\xc3\xbcnsche f\xc3\xbcr den Samstag: Erst putzen die Siegburger Siegburg (DANKE vorab an 2.300 Teilnehmer!) , dann... https://t.co/qg5u3dGfcE'",Facebook,,False,1,1,,,,False
841652703621177345,siegburgaktuell,Siegburg,2017-03-14 14:10:16,"b'Eine ruhige Kugel schieben sie nur beim Billard. Ren\xc3\xa9 Lobe ist neuer Leiter des Jugendzentrums Kulturcaf\xc3\xa9,... https://t.co/6q2AFpEGKd'",Facebook,,False,0,0,,,,False
840908718543900676,siegburgaktuell,Siegburg,2017-03-12 12:53:56,b'Das hat Geschm\xc3\xa4ckle: 1. Siegburger Suppensause l\xc3\xa4uft im Sion. Danke an die zahlreichen Teilnehmer! https://t.co/93YyTrv0BF',Facebook,,False,0,1,,,,False
840537386580869120,siegburgaktuell,Siegburg,2017-03-11 12:18:24,"b'Gut besuchte F\xc3\xbchrung am Tag der offenen T\xc3\xb6pferei. Christoph Hasenberg zeigt den Teilnehmern der F\xc3\xbchrung ""Die... https://t.co/xMhTEaS3Ky'",Facebook,,False,0,0,,,,False
840184550785445888,siegburgaktuell,Siegburg,2017-03-10 12:56:21,"b'""Jede Jeck es anders"" - auch in der Fastenzeit. Gisbert Baltes liest heute Abend, 20 Uhr, im Stadtmuseum. Karten... https://t.co/y3KI67wvH3'",Facebook,,False,0,0,,,,False
839786730731552768,siegburgaktuell,Siegburg,2017-03-09 10:35:33,b'https://t.co/15tQFPEZtJ',Facebook,,False,0,0,,,,False
839470213166940162,siegburgaktuell,Siegburg,2017-03-08 13:37:50,b'Beckenbauer im Oktopus!\n\nhttps://t.co/qRdQL62bKm https://t.co/qMeAAqAGJw',Facebook,,False,0,0,,,,False
838754723742298114,siegburgaktuell,Siegburg,2017-03-06 14:14:44,"b'Offene T\xc3\xb6pferei kommenden Samstag/Sonntag bei den Hasenbergs in der Kaiserstrasse 130, 10 bis 18 Uhr. Dazu... https://t.co/gTSqMXdoo9'",Facebook,,False,0,0,,,,False
838343360410714112,siegburgaktuell,Siegburg,2017-03-05 11:00:07,b'Benefiz-Suppen-Kochwettbewerb - Die erste gro\xc3\x9fe Suppen-Sause beginnt in genau einer Woche; 12.03. ab 12.00 Uhr.... https://t.co/FBV50t607j',Facebook,,False,0,0,,,,False
838011174700658688,siegburgaktuell,Siegburg,2017-03-04 13:00:08,b'Vorank\xc3\xbcndigung - \nDeutsche Meisterschaft Hauptgruppe S\nin den lateinamerikanischen T\xc3\xa4nzen mit \xc3\xbcber 50 Paaren... https://t.co/SfFU5gnMWl',Facebook,,False,0,0,,,,False
837288012144865281,siegburgaktuell,Siegburg,2017-03-02 13:06:32,"b'Auch eine Vorsch\xc3\xbclerin zu Hause, die gern vorgelesen bekommt? Dann demn\xc3\xa4chst den Samstagsservive der... https://t.co/LqYyjvaLMt'",Facebook,,False,0,0,,,,False
836248597964423168,siegburgaktuell,Siegburg,2017-02-27 16:16:17,b'Turbulentes Marktgeschehen. Sieburch Alaaf! https://t.co/kASmcWHS8J',Facebook,,False,0,0,,,,False
834781363630964736,siegburgaktuell,Siegburg,2017-02-23 15:06:01,"b'3500 Leute, tolle Stimmung, Wieverfastelovend auf dem Markt https://t.co/GU3g7xPKXl'",Facebook,,False,1,0,,,,False
834680502195978240,siegburgaktuell,Siegburg,2017-02-23 08:25:13,"b'Gleich geht sie los, die gro\xc3\x9fe Weiberfastnachtsparty auf dem Markt. Der Eintritt kostet 5 Euro, das vorgesehene... https://t.co/qOc8s09veS'",Facebook,,False,0,0,,,,False
833998606512316416,siegburgaktuell,Siegburg,2017-02-21 11:15:37,"b'Ein Syrer, der vom Fl\xc3\xbcchtling zum Barista auf dem Coffee-Bike wird. Ein Leuchtturm, dessen Lichter vom... https://t.co/xWUoC6nHs2'",Facebook,,False,0,0,,,,False
832920288992034817,siegburgaktuell,Siegburg,2017-02-18 11:50:46,b'Widerstand zwecklos! https://t.co/Id3zuDYcTU',Facebook,,False,0,1,,,,False
832549778160488448,siegburgaktuell,Siegburg,2017-02-17 11:18:29,"b'Giganten-Gockel gegen den Prinz und ""Die Mannschaft"": Showdown morgen ab 11.11 Uhr auf dem Markt beim Rathaussturm.'",Facebook,,False,0,0,,,,False
831857531601436672,siegburgaktuell,Siegburg,2017-02-15 13:27:45,b'Positive Marktentwicklung in Siegburg. https://t.co/pNcZAeMD2y',Facebook,,False,1,0,,,,False
831516310907518976,siegburgaktuell,Siegburg,2017-02-14 14:51:52,"b""Na, gibt's denn das - die Kraniche ziehen fr\xc3\xbcher als die Jecken. Spricht f\xc3\xbcr 'nen hei\xc3\x9fen Stra\xc3\x9fenkarneval! https://t.co/b6leir3u4A""",Facebook,,False,4,3,,,,False
831124615690850306,siegburgaktuell,Siegburg,2017-02-13 12:55:24,"b'Mobbing, Hetze, Diskriminierung: Weil in den Sozialen Netzwerken h\xc3\xa4ufig die Tabus des menschlichen Miteinanders... https://t.co/S0GCBjDCmN'",Facebook,,False,0,1,,,,False
829982500701233152,siegburgaktuell,Siegburg,2017-02-10 09:17:03,"b'Gestein rollt auf die Talsperrenstra\xc3\x9fe in Seligenthal, diese ist derzeit gesperrt. Weil noch ein loser Brocken... https://t.co/3tQfb53xzv'",Facebook,,False,0,0,,,,False
829694510275948544,siegburgaktuell,Siegburg,2017-02-09 14:12:40,"b""Man sieht sie wieder, die Siegburger Sehensw\xc3\xbcrdigkeit. Beim Licht gibt's eine wichtige Konzept-\xc3\x84nderung: Kirche... https://t.co/5lG2ZHhmiw""",Facebook,,False,0,1,,,,False
828993255631097856,siegburgaktuell,Siegburg,2017-02-07 15:46:08,"b""Guckst du - alle Zugzeiten und Zugwege gibt's von uns frisch aufs Handy!\n\nSonntag, 19.02.17, 13:30 Uhr... https://t.co/uIiPgcrjsF""",Facebook,,False,0,0,,,,False
827805702852849664,siegburgaktuell,Siegburg,2017-02-04 09:07:14,b'Drohender Felsabgang am Riemberg. Der Fels soll mittels eines aufblasbaren Kissens kontrolliert zum Abgang... https://t.co/yVe9hDPL7k',Facebook,,False,0,0,,,,False
827506221909413889,siegburgaktuell,Siegburg,2017-02-03 13:17:12,b'Vornehmlich Familien werden in die neue Fl\xc3\xbcchtlingsunterkunft Am Kannenofen ziehen. Morgen beginnt um 12 Uhr ein... https://t.co/WsmAhMvZk7',Facebook,,False,0,0,,,,False
827122261459091456,siegburgaktuell,Siegburg,2017-02-02 11:51:28,"b'Kontrollierte Sprengung, Sperrung aufgehoben.... https://t.co/1hhXDl80Ft'",Facebook,,False,0,0,,,,False
827076477300699136,siegburgaktuell,Siegburg,2017-02-02 08:49:33,"b'Herrenloser Koffer vor dem Restaurant ""Subway""am Bahnhof. Polizei, Bundespolizei und Ordnungsamt sind vor Ort.... https://t.co/4JwHd50FdP'",Facebook,,False,0,0,,,,False
826770783980625920,siegburgaktuell,Siegburg,2017-02-01 12:34:50,"b'Anno-Sch\xc3\xbcler im Oktober 2016 am Ort des gr\xc3\xb6\xc3\x9ften Verbrechens, das Menschen an Menschen ver\xc3\xbcbt haben. Das Gedenken... https://t.co/pTUOJ53hKZ'",Facebook,,False,1,0,,,,False
826098889233166336,siegburgaktuell,Siegburg,2017-01-30 16:04:58,b'Wasserrohrbruch unter dem Minikreisel Humperdinckstra\xc3\x9fe/Friedrich-Ebert-Stra\xc3\x9fe (am Krankenhaus). Feuerwehr und... https://t.co/pM2oNh08ci',Facebook,,False,0,0,,,,False
826072525054607360,siegburgaktuell,Siegburg,2017-01-30 14:20:12,b'Herausforderung\xc2\xb2 f\xc3\xbcr Mamas und Papas von Zwillingen. Im Zwillingselterntreff tauschen Sie sich untereinander aus.... https://t.co/weGhI2mHxd',Facebook,,False,0,0,,,,False
824951742127292416,siegburgaktuell,Siegburg,2017-01-27 12:06:36,"b'Polizeihubschrauer kreist derzeit \xc3\xbcber Siegburg. Zuvor: Verkehrskontrolle am Neuenhof, PKW (mit zwei Insassen)... https://t.co/aAKl5dsPcK'",Facebook,,False,1,0,,,,False
824230220869894145,siegburgaktuell,Siegburg,2017-01-25 12:19:32,b'Wie setzt die Stadt Spendengelder f\xc3\xbcr Fl\xc3\xbcchtlinge ein?  So:... https://t.co/Dh5G0O61Ae',Facebook,,False,0,0,,,,False
823879174268010497,siegburgaktuell,Siegburg,2017-01-24 13:04:36,b'3. B\xc3\xbcrgerWerkstatt zur Zukunft des Rathauses heute Abend um 19 Uhr im Stadtmuseum.... https://t.co/hcD26JYMfq',Facebook,,False,0,0,,,,False
822513234087444480,siegburgaktuell,Siegburg,2017-01-20 18:36:51,"b""Gleich geht's los! Das Poetry Slam Jahresfinale https://t.co/F4mQ1uAGNI""",Facebook,,False,0,0,,,,False
821680260899106816,siegburgaktuell,Siegburg,2017-01-18 11:26:54,b'Weiberfastnacht auf dem Markt - so l\xc3\xa4uft die Fete.... https://t.co/62ogHlO3Wj',Facebook,,False,0,0,,,,False
821348229996572673,siegburgaktuell,Siegburg,2017-01-17 13:27:32,b'Wir sagen danke an Kerstin Babiuch und ihre 29 Mitarbeiter vom Post-Zustellst\xc3\xbctzpunkt Siegburg f\xc3\xbcr 160.000... https://t.co/bae4bP7H2O',Facebook,,False,0,0,,,,False
821006325706539008,siegburgaktuell,Siegburg,2017-01-16 14:48:56,"b'Das neue Programm ist da! 824-mal macht die VHS sie schlauer, beweglicher, ges\xc3\xbcnder. 824 Kurse, Vortr\xc3\xa4ge,... https://t.co/SRyTfmuS58'",Facebook,,False,0,0,,,,False
819872063322202114,siegburgaktuell,Siegburg,2017-01-13 11:41:47,"b'Nicht gegen das Wetter wettern, am Sonntag zur Reisemesse in die Rhein-Sieg-Halle gehen und besseres Wetter... https://t.co/V1kviMjFtO'",Facebook,,False,0,0,,,,False
819556293983817730,siegburgaktuell,Siegburg,2017-01-12 14:47:01,"b'Sturm und Schnee - dies die Vorhersage des Deutschen Wetterdiensts. Egal wie es nun wird, ein bisschen eher... https://t.co/30j4gFB4BZ'",Facebook,,False,0,0,,,,False
818820844294144000,siegburgaktuell,Siegburg,2017-01-10 14:04:36,"b'Hand hoch: Wer ist in der Schule mal kleben geblieben, hat die ""individuelle Schulzeitverl\xc3\xa4ngerung"" in Anspruch... https://t.co/s1j2arRZMU'",Facebook,,False,0,0,,,,False
818446802320052224,siegburgaktuell,Siegburg,2017-01-09 13:18:18,b'Kaiserin sein - ein schweres Los. Sissi wei\xc3\x9f davon ein Lied zu singen. Das tut sie morgen um 20 Uhr in der... https://t.co/8hFHBKImrK',Facebook,,False,0,0,,,,False
817457778256183296,siegburgaktuell,Siegburg,2017-01-06 19:48:16,b'Alaaf! https://t.co/a6o7I8Y5py',Facebook,,False,1,0,,,,False
