tweet_id;screenname;city;date;text;source;reply_to;is_quote;retweetet_count;favorited_count;hashtags;retweeted_text;retweeted_user;is_retweet
930843352324591616;stadtmonheim;Monheim am Rhein;2017-11-15 17:02:04;b'Mit Vorlesebus, Kindertheater, Comedy-Hopping und Herbstkino wird am kommenden Wochenende f\xc3\xbcr Klein und Gro\xc3\x9f... https://t.co/l8LYsIbM2D';Facebook;;False;0;0;;;;False
930798075563728896;stadtmonheim;Monheim am Rhein;2017-11-15 14:02:09;b'Die Ratsmitglieder in Langenfeld und Monheim am Rhein haben den Abschluss einer gemeinsamen \xc3\xb6ffentlich-rechtlichen... https://t.co/suYwaW10aF';Facebook;;False;0;0;;;;False
930749737162215426;stadtmonheim;Monheim am Rhein;2017-11-15 10:50:04;b'Das Ulla-Hahn-Haus, die Bibliothek Monheim am Rhein, der F\xc3\xb6rderverein Pro Literatur und die BSM feiern den... https://t.co/Z3JjkDBBpH';Facebook;;False;0;0;;;;False
930717022224371712;stadtmonheim;Monheim am Rhein;2017-11-15 08:40:04;b'Der 3. Band der \xe2\x80\x9eGeschichte der Stadt Monheim am Rhein\xe2\x80\x9c erscheint zwar erst im n\xc3\xa4chsten Jahr. Doch am Freitag... https://t.co/uSfYEjaENo';Facebook;;False;0;0;;;;False
930670259048239105;stadtmonheim;Monheim am Rhein;2017-11-15 05:34:15;b'Das historische Altstadtmodell wird heute vor\xc3\xbcbergehend abmontiert. Nach einer kleinen Korrektur kehrt es in zwei... https://t.co/d3hwjamu39';Facebook;;False;0;1;;;;False
