tweet_id;screenname;city;date;text;source;reply_to;is_quote;retweetet_count;favorited_count;hashtags;retweeted_text;retweeted_user;is_retweet
930470670294814721;stadtmonheim;Monheim am Rhein;2017-11-14 16:21:09;b'Die \xc3\x9cberreste der alten Maternuskapelle im Innenhof von Haus B\xc3\xbcrgel sind seit August 2016 wieder sichtbar. \xc3\x9cber... https://t.co/LGRmAeN0DN';Facebook;;False;0;0;;;;False
930418052625248256;stadtmonheim;Monheim am Rhein;2017-11-14 12:52:04;b'Beim 3. Monheimer Inklusionstag steht am Samstag der erfolgreiche Start der Miniprojektb\xc3\xb6rse \xe2\x80\x9eAktiv inklusiv!\xe2\x80\x9c im... https://t.co/3U6HKtAPtm';Facebook;;False;0;0;;;;False
930377700409331715;stadtmonheim;Monheim am Rhein;2017-11-14 10:11:44;b'Gute Nachrichten: Ab Freitag ist die Kapellenstra\xc3\x9fe wieder in beide Richtungen befahrbar. Auch die Stra\xc3\x9fe An d\xe2\x80\x99r... https://t.co/OKOAPCxCX9';Facebook;;False;0;1;;;;False
930316631351406593;stadtmonheim;Monheim am Rhein;2017-11-14 06:09:04;b'Welche Versicherungen sind im Alter noch wichtig? Antworten kennt der Versicherungsexperte Philipp Opfermann. Am... https://t.co/dZXFQYI8jQ';Facebook;;False;0;0;;;;False
930128893687853056;stadtmonheim;Monheim am Rhein;2017-11-13 17:43:03;b'Wer getragene Kleidung auf dem Tr\xc3\xb6delmarkt verkaufen m\xc3\xb6chte, muss oft fr\xc3\xbch aufstehen. F\xc3\xbcr jugendliche... https://t.co/XPNAm59KOw';Facebook;;False;0;1;;;;False
